version 4, schema pdlc_tables
unknown1(string)	unknown2(int)	unknown3(optstring)	unknown4(int)
"pdlc_imperial_guard_pack"	34177	"A brand new pack featuring 6 elite units from the Napoleonic Wars and an alternative Battle of Waterloo, fought from Wellington’s perspective. Each unit comes with their own unique combination of statistics and abilities, and can be used in both single and multiplayer."	1
"pdlc_coalition_pack"	34178	"A brand new pack featuring 6 elite units from the Napoleonic Wars and the Battle of Friedland, fought by Russia and France. Each unit comes with their own unique statistics, and can be used in both single and multiplayer."	2
"pdlc_peninsular_war_campaign"	34179	"A brand new campaign focusing on the Napoleonic invasion of Spain and Portugal and the British effort to expel France from the region. Features include new guerrilla and auxiliary battlefield units, new buildings, and three brand new agent types for use in the propaganda war."	3
"pdlc_imperial_eagle_pack"	38185	"The Imperial Eagle Pack comprises five units from the Elite Regiment Pack, four units previously available only with pre-orders, and three exclusive units - the Archduke Ferdinand Cuirassiers, the 10th Hussars, and the Lifeguard Cossacks. These twelve faction specific units are available in both single and multiplayer modes."	4
