version 1, schema quotes_tables, guid 1b10e05f-5f3e-4917-a2ca-da90bd49a3ef
"My acts mark the land; time makes ghosts of every deed; as snow hides footprints."	"death_poem"	"1985"
"Flash of steel stills me; calmness mirrors the ocean; I await the waves."	"death_poem"	"1993"
"My wake leaves little; but as ripples reach the sea; they become great waves."	"death_poem"	"1997"
"I fall on my blade; crimson blossoms seed the earth; the spring buds drink deep."	"death_poem"	"2001"
"Autumn trees shed leaves; skinning the tree one by one; until it is bare."	"death_poem"	"2003"
"My eyes grow heavy; as blackened storm clouds grow near; engulfing the sun."	"death_poem"	"2013"
"Summer heat cracks dirt; weed tendrils escape and grab; dragging my bleached bones."	"death_poem"	"2017"
"Dripping morning dew; mimics the blood from a blade; it does not wake me."	"death_poem"	"2026"
"The death of blossoms; is not something to grieve on; but the way of things."	"asakura_soteki"	"2034"
"Melting icicles; once proud soldiers, lose all form; returning to streams."	"death_poem"	"2042"
"Gold arcs through the sky; as a breeze lifts fallen leaves; and I leave my dream."	"death_poem"	"2043"
"Everything grows cold; stillness like a frozen lake; there will be no thaw."	"death_poem"	"2046"
"Laying in the shade; dappled sunlight warms my face; a welcome farewell."	"death_poem"	"2054"
"Frost coats my body; a final suit of armour; buried in silver."	"death_poem"	"2063"
"Journeying westward; dried leaves crumble underfoot; blown by autumn wind."	"death_poem"	"2066"
"Lines etched in my face; are leafless winter branches; a map of my life. "	"death_poem"	"2068"
"Memories fading; awakening from the dream; gone like morning dew. "	"death_poem"	"2077"
"Covered by blossoms; I curl up to the dreaming; nature’s own blanket"	"death_poem"	"2080"
"Up into the sky; I kiss the falling snowflakes; as they pass me by"	"death_poem"	"2084"
"Twice I awaken; once at the first burst of spring; once in wintertime."	"death_poem"	"2086"
"Crossing the river; takes me from the familiar; to new adventures."	"death_poem"	"2095"
"Summer insects buzz; over new fragrant flowers; and fallen soldiers. "	"death_poem"	"2102"
"Spring blinks and withers; sheds its skin then dons a cloak; of sunset gold."	"death_poem"	"2107"
"Willows slowly stoop; preparing to meet the ground; as autumn arrives."	"death_poem"	"2115"
"In the autumn time; you cannot catch every leaf; nor halt coming age"	"death_poem"	"2124"
"Heat haze of summer; obscures a man’s path ahead; an unclear future."	"death_poem"	"2131"
"A tree’s skeleton; exposed by autumn season; ready for new life"	"death_poem"	"2140"
"Spring stretches and bursts; spilling forth life – but not me; my spring was last year"	"death_poem"	"2144"
"A generous rain; it lands hard on eyes that; neither flinch nor blink."	"death_poem"	"2147"
"A cold, low whistle; accompanies my last breath; wind in sympathy."	"death_poem"	"2148"
"The new year begins; my eyes hunger for the sight; of my last sunrise."	"death_poem"	"2151"
"Turning the snow pink; in the absence of springtime; I create blossoms."	"death_poem"	"2160"
"The mighty are destroyed at the last, they are but as the dust before the wind."	"tale_heike"	"2166"
"I speak of the old Japan, because out of the ashes of the old Japan there has risen a new Japan."	"shigeru_yoshida"	"2172"
"We pray that henceforth not only Japan but all mankind may know the blessings of harmony and progress."	"shigeru_yoshida"	"2180"
"If war should break out between England and Japan, the latter would suffer much more than the former. "	"townsend_harris"	"2185"
"No matter how many people wash the stones with their tears, these names will never vanish from the world."	"matsudaira_katamori"	"2195"
"We swear by the deities that if the Imperial Flag is once raised we will go through fire and water to ease the Emperor's mind."	"loyalist_oath"	"2201"
"If that double-bolted land, Japan, is ever to become hospitable, it is the whale-ship alone to whom the credit will be due; for already she is on the threshold."	"herman_melville"	"2203"
"It was an era where 100 people may hold 100 different arguments and you can't say who's wrong."	"unknown"	"2208"
"If you have one eye on your destination, then you have only one eye with which to find the way."	"unknown"	"2216"
"Nationalism is power hunger tempered by self-deception."	"orwell"	"2217"
"The backbone and real power of any navy are the vessels which, by due proportion of defensive and offensive powers, are capable of giving and taking hard knocks."	"mahan"	"2220"
"These are the only objects for which I have sent Commodore Perry, with a powerful squadron, to pay a visit to Your Imperial Majesty's renowned city of Edo: friendship, commerce, a supply of coal and provisions, and protection for our shipwrecked people."	"millard_fillmore"	"2224"
"In whatever situation a person finds himself, he should not abandon his favourite ways and his special abilities."	"sakamoto_ryoma"	"2234"
"A hero should go his own way!"	"sakamoto_ryoma"	"2241"
"Anything can be accomplished if you take responsibility for doing at least 80 percent to 90 percent of it yourself. Pass the remaining 10-20 percent of responsibility on to others and give them all the credit."	"sakamoto_ryoma"	"2249"
"I never do verbal battle with others, since even if I win an argument I can't change the other person's way of life."	"sakamoto_ryoma"	"2253"
"I am a person who raises himself up to the next level, rather than becoming discouraged."	"sakamoto_ryoma"	"2254"
"If you are a man, even if you die in a ditch during battle, you will die pitching forward."	"sakamoto_ryoma"	"2259"
"The purpose of coming into the world is to accomplish one's duties."	"sakamoto_ryoma"	"2263"
"The orders of the Tycoon, received from Kyoto, are to the effect that the ports are to be closed and the foreigners driven out, because the people of the country do not desire intercourse with foreign countries."	"ogasawara_dzusho"	"2273"
"It is, in fact, a declaration of war by Japan itself against the whole of the Treaty Powers, and the consequences of which, if not at once arrested, it will have to expiate by the severest and most merited chastisement."	"edward_neale"	"2283"
"It would be a good thing if the boat carrying the mission members sank to the bottom of the ocean."	"saigo_mission"	"2287"
"All action takes place, so to speak, in a kind of twilight, which like a fog or moonlight, often tends to make things seem grotesque and larger than they really are. "	"clausewitz"	"2292"
"If the leader is filled with high ambition and if he pursues his aims with audacity and strength of will, he will reach them in spite of all obstacles."	"clausewitz"	"2299"
"It is even better to act quickly and err than to hesitate until the time of action is past."	"clausewitz"	"2306"
"Politics is the womb in which war develops. "	"clausewitz"	"2308"
"The backbone of surprise is fusing speed with secrecy. "	"clausewitz"	"2315"
"The more a general is accustomed to place heavy demands on his soldiers, the more he can depend on their response."	"clausewitz"	"2319"
"To secure peace is to prepare for war."	"clausewitz"	"2320"
"War is not an independent phenomenon, but the continuation of politics by different means."	"clausewitz"	"2330"
"War is the domain of physical exertion and suffering."	"clausewitz"	"2340"
"War is the province of danger."	"clausewitz"	"2342"
"Pursue one great decisive aim with force and determination."	"clausewitz"	"2345"
"Two qualities are indispensable: first, an intellect that, even in the darkest hour, retains some glimmerings of the inner light which leads to truth; and second, the courage to follow this faint light wherever it may lead."	"clausewitz"	"2352"
"A government must not waiver once it has chosen it's course. It must not look to the left or right but go forward."	"bismarck"	"2362"
"Anyone who has ever looked into the glazed eyes of a soldier dying on the battlefield will think hard before starting a war."	"bismarck"	"2369"
"The great questions of the day will not be settled by means of speeches and majority decisions but by iron and blood."	"bismarck"	"2379"
"The main thing is to make history, not to write it."	"bismarck"	"2388"
"He was fearsome even when drinking. People would talk about whom they had killed today, and whom they were going to kill tomorrow. It was all so frightful. According to what I had heard, by that time Kondo had killed fifty or sixty men."	"kondo_mistress"	"2395"
"Though my body may decay on the island of Ezo, my spirit guards my lord in the east."	"hijikata_toshizo"	"2400"
"The Shogunate is run by a band of fools divorced from reality."	"saigo_takamori"	"2406"
"Submitting to the will of another; I have nothing to say this day; I value honour above life; Ah, the long flashing sword to which I readily surrender; and repay my lord's kindness with my life."	"kondo_death_poem"	"2410"
"He was a crafty scoundrel who committed evil for many years and killed a countless number of our men. But now he's been arrested and will die…"	"tani_tateki"	"2413"
"His countenance was the same as always in the face of death, and he died with composure. Those watching shed tears of sorrow for Kondo. He was truly a great man, unequalled throughout the ages."	"shimada_kai"	"2420"
"Swords and spears will no longer be of any use in battle. They are simply no match for guns."	"hijikata_toshizo"	"2423"
"Revere the Emperor, expel the barbarians."	"sonno_joi"	"2431"
"A man must not live under the same sky as one who has injured his lord or father."	"ieyasu_constitution"	"439"
"The way of the warrior is death. This means choosing death whenever there is a choice between life and death. It means nothing else."	"yamamoto_tsunetomo"	"446"
"The Four Oaths: Never be late with respect to the way of the warrior; be useful to the lord; be respectful to your parents; get beyond love and grief: exist for the good of man."	"yamamoto_tsunetomo"	"447"
"Dishonour is like a scar on a tree, which time, instead of effacing, only helps to enlarge."	"bushido_maxim"	"455"
"A little piece of gold may be highly valued, but if it gets in one's eye, the result will be darkness."	"iwamizudera_monogatari"	"458"
"Even if one has learned all the sayings of the sages and saints, he should not insist on them obstinately."	"asakura_soteki"	"467"
"A general of great merit should be said to be a man who has met with at least one great defeat."	"asakura_soteki"	"475"
"A dog is not considered a good dog because he is a good barker. A man is not considered a good man because he is a good talker. "	"buddha"	"482"
"Do not dwell in the past, do not dream of the future, concentrate the mind on the present moment."	"buddha"	"490"
"The tongue like a sharp knife...kills without drawing blood."	"buddha"	"497"
"Holding on to anger is like grasping a hot coal with the intent of throwing it at someone else; you are the one who gets burned. "	"buddha"	"504"
"Even death is not to be feared by one who has lived wisely. "	"buddha"	"513"
"You will not be punished for your anger, you will be punished by your anger."	"buddha"	"522"
"The whole secret of existence is to have no fear."	"buddha"	"532"
"Nothing ever exists entirely alone; everything is in relation to everything else."	"buddha"	"542"
"The foot feels the foot when it feels the ground."	"buddha"	"548"
"It is a man's own mind, not his enemy or foe, that lures him to evil ways."	"buddha"	"554"
"A flower falls, even though we love it; and a weed grows, even though we do not love it."	"dogen_zenji"	"560"
"When we discover that the truth is already in us, we are all at once our original selves."	"dogen_zenji"	"563"
"The colour of the mountains is Buddha's body; the sound of running water is his great speech."	"dogen_zenji"	"573"
"Do not think you will necessarily be aware of your own enlightenment."	"dogen_zenji"	"578"
"He will win who knows when to fight and when not to fight."	"sun_tzu"	"584"
"He will win who knows how to handle both superior and inferior forces."	"sun_tzu"	"587"
"He will win whose army is animated by the same spirit throughout all its ranks."	"sun_tzu"	"596"
"He will win who, prepared himself, waits to take the enemy unprepared."	"sun_tzu"	"603"
"He will win who has military capacity and is not interfered with by the sovereign."	"sun_tzu"	"610"
"Victorious warriors win first and then go to war, while defeated warriors go to war first and then seek to win."	"sun_tzu"	"620"
"There is no instance of a nation benefiting from prolonged warfare."	"sun_tzu"	"623"
"The skilful employer of men will employ the wise man, the brave man, the covetous man, and the stupid man."	"sun_tzu"	"633"
"Opportunities multiply as they are seized."	"sun_tzu"	"635"
"If you know your enemy and know yourself, you will not be imperilled by a hundred battles. If you do not know the others but do know yourself, you will win one and lose one. If you do not know the enemy and do not know yourselves you will be in danger in every battle."	"sun_tzu"	"640"
"Act after having made assessments. The one who first knows the measure of far and near wins — this is the rule of armed struggle."	"sun_tzu"	"643"
"To perceive victory when it is known to all is not really skilful… It does not take much strength to lift a hair, it does not take sharp eyes to see the sun and moon, it does not take sharp ears to hear the thunderclap."	"sun_tzu"	"647"
"All men can see these tactics whereby I conquer, but what none can see is the strategy out of which victory is evolved."	"sun_tzu"	"648"
"All warfare is based on deception."	"sun_tzu"	"653"
"Be extremely subtle, even to the point of formlessness. Be extremely mysterious, even to the point of soundlessness. Thereby you can be the director of the opponent's fate."	"sun_tzu"	"659"
"Can you imagine what I would do if I could do all I can?"	"sun_tzu"	"667"
"Confront them with annihilation, and they will then survive; plunge them into a deadly situation, and they will then live. When people fall into danger, they are then able to strive for victory."	"sun_tzu"	"670"
"For them to perceive the advantage of defeating the enemy, they must also have their rewards."	"sun_tzu"	"673"
"For to win one hundred victories in one hundred battles is not the acme of skill. To subdue the enemy without fighting is the acme of skill."	"sun_tzu"	"678"
"He who is prudent, and lies in wait for an enemy who is not, will be victorious."	"sun_tzu"	"684"
"He who knows when he can fight, and when he cannot, will be victorious."	"sun_tzu"	"689"
"Hence that general is skilful in attack whose opponent does not know what to defend; and he is skilful in defence whose opponent does not know what to attack."	"sun_tzu"	"693"
"If ignorant both of your enemy and yourself, you are certain to be in peril."	"sun_tzu"	"700"
"If our soldiers are not overburdened with money, it is not because they have a distaste for riches; if their lives are not unduly long, it is not because they are disinclined to longevity."	"sun_tzu"	"703"
"If you are far from the enemy, make him believe you are near."	"sun_tzu"	"704"
"In the practical art of war, the best thing of all is to take the enemy's country whole and intact; to shatter and destroy it is not so good."	"sun_tzu"	"715"
"Invincibility lies in the defence; the possibility of victory in the attack."	"sun_tzu"	"717"
"It is essential to seek out enemy agents who have come to conduct espionage against you and to bribe them to serve you. Give them instructions and care for them. Thus double agents are recruited and used."	"sun_tzu"	"723"
"It is only the enlightened ruler and the wise general who will use the highest intelligence of the army for the purposes of spying, and thereby they achieve great results."	"sun_tzu"	"724"
"Now the reason the enlightened prince and the wise general conquer the enemy whenever they move, and their achievements surpass those of ordinary men, is foreknowledge."	"sun_tzu"	"734"
"Of all those in the army close to the commander none is more intimate than the secret agent; of all rewards none more liberal than those given to secret agents; of all matters none is more confidential than those relating to secret operations."	"sun_tzu"	"736"
"Pretend inferiority and encourage his arrogance."	"sun_tzu"	"740"
"Prohibit the taking of omens, and do away with superstitious doubts. Then, until death itself comes, no calamity need be feared."	"sun_tzu"	"747"
"Regard your soldiers as your children, and they will follow you into the deepest valleys; look on them as your own beloved sons, and they will stand by you even unto death."	"sun_tzu"	"750"
"Secret operations are essential in war; upon them the army relies to make its every move."	"sun_tzu"	"751"
"Strategy without tactics is the slowest route to victory. Tactics without strategy is the noise before defeat."	"sun_tzu"	"752"
"Supreme excellence consists in breaking the enemy's resistance without fighting."	"sun_tzu"	"762"
"The enlightened ruler is heedful, and the good general full of caution."	"sun_tzu"	"766"
"The general who advances without coveting fame and retreats without fearing disgrace, whose only thought is to protect his country and do good service for his sovereign, is the jewel of the kingdom."	"sun_tzu"	"769"
"The general who wins the battle makes many calculations in his temple before the battle is fought. The general who loses makes but few calculations beforehand."	"sun_tzu"	"774"
"The good fighters of old first put themselves beyond the possibility of defeat, and then waited for an opportunity of defeating the enemy."	"sun_tzu"	"784"
"The opportunity to secure ourselves against defeat lies in our own hands, but the opportunity of defeating the enemy is provided by the enemy himself."	"sun_tzu"	"794"
"The quality of decision is like the well-timed swoop of a falcon which enables it to strike and destroy its victim."	"sun_tzu"	"795"
"The supreme art of war is to subdue the enemy without fighting."	"sun_tzu"	"804"
"Thus, what is of supreme importance in war is to attack the enemy's strategy."	"sun_tzu"	"809"
"To fight and conquer in all our battles is not supreme excellence; supreme excellence consists in breaking the enemy's resistance without fighting."	"sun_tzu"	"816"
"To see victory only when it is within the ken of the common herd is not the acme of excellence."	"sun_tzu"	"825"
"When envoys are sent with compliments in their mouths, it is a sign that the enemy wishes for a truce."	"sun_tzu"	"830"
"If fighting is sure to result in victory, then you must fight, even though the ruler forbid it; if fighting will not result in victory, then you must not fight even at the ruler's bidding."	"sun_tzu"	"833"
"Where the army is, prices are high; when prices rise the wealth of the people is exhausted."	"sun_tzu"	"839"
"The expert in battle seeks his victory from strategic advantage and does not demand it from his men."	"sun_tzu"	"843"
"Being unconquerable lies with yourself; being conquerable lies with your enemy."	"sun_tzu"	"852"
"One defends when his strength is inadequate, he attacks when it is abundant."	"sun_tzu"	"853"
"A leader leads by example, not by force."	"sun_tzu"	"855"
"If words of command are not clear and distinct, if orders are not thoroughly understood, the general is to blame. But if his orders are clear, and the soldiers nevertheless disobey, then it is the fault of their officers."	"sun_tzu"	"856"
"Bestow rewards without respect to customary practice; publish orders without respect to precedent. Thus you may employ the entire army as you would one man."	"sun_tzu"	"860"
"Speed is the essence of war. Take advantage of the enemy's unpreparedness; travel by unexpected routes and strike him where he has taken no precautions."	"sun_tzu"	"870"
"Too frequent rewards indicate that the general is at the end of his resources; too frequent punishments that he is in acute distress."	"sun_tzu"	"872"
"To a surrounded enemy, you must leave a way of escape."	"sun_tzu"	"882"
"Subtle and insubstantial, the expert leaves no trace; divinely mysterious, he is inaudible. Thus he is master of his enemy's fate."	"sun_tzu"	"891"
"The ultimate in disposing one's troops is to be without ascertainable shape. Then the most penetrating spies cannot pry in nor can the wise lay plans against you."	"sun_tzu"	"892"
"The art of giving orders is not to try to rectify the minor blunders and not be swayed by petty doubts."	"sun_tzu"	"893"
"When torrential water tosses boulders, it is because of its momentum. When the strike of a hawk breaks the body of its prey, it is because of timing."	"sun_tzu"	"895"
"What the ancients called a clever fighter is one who not only wins, but excels in winning with ease."	"sun_tzu"	"902"
"It is truly regrettable that a person will treat a man who is valuable to him well, and a man who is worthless to him poorly."	"hojo_shigetoki"	"905"
"One should have insight into this world of dreams that passes in the twinkling of an eye."	"hojo_shigetoki"	"908"
"Death refuses to wait for the space of a breath; life is more evanescent than a mayfly or a lightning flash."	"tale_heike"	"917"
"If thou knowest only what it is to conquer, and knowest not what it is to be defeated, woe unto thee; it will fare ill with thee."	"tokugawa_ieyasu"	"920"
"There are seven emotions: joy, anger, anxiety, adoration, grief, fear, and hate, and if a man does not give way to these he can be called patient."	"tokugawa_ieyasu"	"923"
"One should not be envious of someone who has prospered by unjust deeds. Nor should he disdain someone who has fallen while adhering to the path of righteousness."	"imagawa_sadayo"	"928"
"Just as water will conform to the shape of the vessel that contains it, so will a man follow the good and evil of his companions."	"imagawa_sadayo"	"929"
"Without knowledge of learning, one will ultimately have no military victories."	"imagawa_sadayo"	"935"
"Beginning is easy - Continuing is hard. "	"japanese_proverb"	"937"
"One kind word can warm three winter months."	"japanese_proverb"	"939"
"The reverse side also has a reverse side."	"japanese_proverb"	"943"
"The stake that sticks out gets hammered down."	"japanese_proverb"	"951"
"If you do not enter the tiger's cave, you will not catch its cub."	"japanese_proverb"	"957"
"Even monkeys fall from trees."	"japanese_proverb"	"966"
"The clever hawk hides its claws."	"japanese_proverb"	"970"
"It is said that the inferior seek to emulate the superior. Thus, if a general slackens only a little, those beneath him will be greatly negligent."	"kato_kiyomasa"	"979"
"One should not be negligent in the way of the retainer. One should rise at four in the morning, practice sword technique, eat one's meal, and train with the bow, the gun, and the horse."	"kato_kiyomasa"	"980"
"As for the decorum at the time of a campaign, one must be mindful that he is a samurai. A person who loves beautification where it is unnecessary is fit for punishment."	"kato_kiyomasa"	"989"
"If a man does not investigate into the matter of bushido daily, it will be difficult for him to die a brave and manly death."	"kato_kiyomasa"	"999"
